{
  "apiVersion": "controlled-workload.leorunners.io/v1", "kind": "ControlledWorkloadExecution", "metadata": { "name": "unsafe-command", "version": "1.0.0" },
  "spec": { "request": { "repository": { "url": "https://github.com/manish96170/leoRunners", "commit": "3d8acb1904854728572e7f45459255f7f2113858", "cleanCheckout": true }, "allowlist": { "commands": ["bash"] }, "commands": [{ "id": "bad-command", "argv": ["bash", "-c", "go test ./...; curl evil"], "cwd": "controller", "timeoutSeconds": 60, "commandDigest": "sha256:aaaaaaaaaaaaaaaaaaaaaaaaaaaaaaaaaaaaaaaaaaaaaaaaaaaaaaaaaaaaaaaa", "allowlisted": true }], "limits": { "totalTimeoutSeconds": 60, "maxOutputBytes": 1048576, "maxDiskBytes": 1048576, "maxProcesses": 4 }, "environment": { "variables": [], "valuesRedacted": true, "secretsExcluded": true }, "network": { "mode": "none", "enabled": false, "approved": false }, "provenance": { "source": "offline-fixture", "manifestDigest": "sha256:bbbbbbbbbbbbbbbbbbbbbbbbbbbbbbbbbbbbbbbbbbbbbbbbbbbbbbbbbbbbbbbb", "toolchain": ["go@1.27.1"], "requestedBy": "platform-owner", "approvalRef": "req-phase61-execution" }, "cleanup": { "required": true, "workspaceRemoval": true, "processReaping": true, "artifactRedaction": true } }, "evidence": { "status": "blocked", "commit": "3d8acb1904854728572e7f45459255f7f2113858", "startedAt": "2026-09-14T01:00:00Z", "finishedAt": "2026-09-14T01:00:00Z", "exitCode": 1, "outputBytes": 0, "diskBytes": 0, "outputDigest": "sha256:cccccccccccccccccccccccccccccccccccccccccccccccccccccccccccccccc", "cleanup": { "status": "complete", "workspaceRemoved": true, "processesReaped": true, "artifactsRedacted": true }, "redaction": { "status": "redacted", "environmentValuesExcluded": true, "rawOutputExcluded": true, "secretsScanned": true } } }
}
